{
 "kind": "quality",
 "model": "picket-forest",
 "version": "0.2.0",
 "synthetic": false,
 "source_run": "can-ids-v3 run (b7aeb348ec0d)",
 "metrics": [
  {
   "name": "f1_known_vehicle_known_attack_median",
   "value": 0.6220361827643046,
   "unit": null,
   "description": "attack-class F1 per frame, known vehicle known attack, median over 4 sets",
   "reference": "can-train-and-test attack labels (official splits)",
   "benchmark": "can-ids-v3",
   "n_items": 4,
   "hardware": null,
   "date": "2026-10-10"
  },
  {
   "name": "f1_known_vehicle_known_attack_worst",
   "value": 0.26276940700435114,
   "unit": null,
   "description": "attack-class F1 per frame, known vehicle known attack, worst over 4 sets",
   "reference": "can-train-and-test attack labels (official splits)",
   "benchmark": "can-ids-v3",
   "n_items": 4,
   "hardware": null,
   "date": "2026-10-10"
  },
  {
   "name": "fa_per_hour_default_known_vehicle_known_attack_median",
   "value": 0.43052405123745163,
   "unit": null,
   "description": "false alarms per hour of the alarm rule, known vehicle known attack, median over 4 sets",
   "reference": "can-train-and-test attack labels (official splits)",
   "benchmark": "can-ids-v3",
   "n_items": 4,
   "hardware": null,
   "date": "2026-10-10"
  },
  {
   "name": "fa_per_hour_default_known_vehicle_known_attack_worst",
   "value": 7.3831036980155575,
   "unit": null,
   "description": "false alarms per hour of the alarm rule, known vehicle known attack, worst over 4 sets",
   "reference": "can-train-and-test attack labels (official splits)",
   "benchmark": "can-ids-v3",
   "n_items": 4,
   "hardware": null,
   "date": "2026-10-10"
  },
  {
   "name": "f1_unknown_vehicle_known_attack_median",
   "value": 0.5487672537054193,
   "unit": null,
   "description": "attack-class F1 per frame, unknown vehicle known attack, median over 4 sets",
   "reference": "can-train-and-test attack labels (official splits)",
   "benchmark": "can-ids-v3",
   "n_items": 4,
   "hardware": null,
   "date": "2026-10-10"
  },
  {
   "name": "f1_unknown_vehicle_known_attack_worst",
   "value": 0.1794464753852992,
   "unit": null,
   "description": "attack-class F1 per frame, unknown vehicle known attack, worst over 4 sets",
   "reference": "can-train-and-test attack labels (official splits)",
   "benchmark": "can-ids-v3",
   "n_items": 4,
   "hardware": null,
   "date": "2026-10-10"
  },
  {
   "name": "fa_per_hour_default_unknown_vehicle_known_attack_median",
   "value": 0.0,
   "unit": null,
   "description": "false alarms per hour of the alarm rule, unknown vehicle known attack, median over 4 sets",
   "reference": "can-train-and-test attack labels (official splits)",
   "benchmark": "can-ids-v3",
   "n_items": 4,
   "hardware": null,
   "date": "2026-10-10"
  },
  {
   "name": "fa_per_hour_default_unknown_vehicle_known_attack_worst",
   "value": 0.6869627480882036,
   "unit": null,
   "description": "false alarms per hour of the alarm rule, unknown vehicle known attack, worst over 4 sets",
   "reference": "can-train-and-test attack labels (official splits)",
   "benchmark": "can-ids-v3",
   "n_items": 4,
   "hardware": null,
   "date": "2026-10-10"
  },
  {
   "name": "f1_known_vehicle_unknown_attack_median",
   "value": 0.49543737117781206,
   "unit": null,
   "description": "attack-class F1 per frame, known vehicle unknown attack, median over 4 sets",
   "reference": "can-train-and-test attack labels (official splits)",
   "benchmark": "can-ids-v3",
   "n_items": 4,
   "hardware": null,
   "date": "2026-10-10"
  },
  {
   "name": "f1_known_vehicle_unknown_attack_worst",
   "value": 0.14678820771996715,
   "unit": null,
   "description": "attack-class F1 per frame, known vehicle unknown attack, worst over 4 sets",
   "reference": "can-train-and-test attack labels (official splits)",
   "benchmark": "can-ids-v3",
   "n_items": 4,
   "hardware": null,
   "date": "2026-10-10"
  },
  {
   "name": "fa_per_hour_default_known_vehicle_unknown_attack_median",
   "value": 0.0,
   "unit": null,
   "description": "false alarms per hour of the alarm rule, known vehicle unknown attack, median over 4 sets",
   "reference": "can-train-and-test attack labels (official splits)",
   "benchmark": "can-ids-v3",
   "n_items": 4,
   "hardware": null,
   "date": "2026-10-10"
  },
  {
   "name": "fa_per_hour_default_known_vehicle_unknown_attack_worst",
   "value": 7.856584283411123,
   "unit": null,
   "description": "false alarms per hour of the alarm rule, known vehicle unknown attack, worst over 4 sets",
   "reference": "can-train-and-test attack labels (official splits)",
   "benchmark": "can-ids-v3",
   "n_items": 4,
   "hardware": null,
   "date": "2026-10-10"
  },
  {
   "name": "f1_unknown_vehicle_unknown_attack_median",
   "value": 0.7686205846671248,
   "unit": null,
   "description": "attack-class F1 per frame, unknown vehicle unknown attack, median over 4 sets",
   "reference": "can-train-and-test attack labels (official splits)",
   "benchmark": "can-ids-v3",
   "n_items": 4,
   "hardware": null,
   "date": "2026-10-10"
  },
  {
   "name": "f1_unknown_vehicle_unknown_attack_worst",
   "value": 0.2615846615846616,
   "unit": null,
   "description": "attack-class F1 per frame, unknown vehicle unknown attack, worst over 4 sets",
   "reference": "can-train-and-test attack labels (official splits)",
   "benchmark": "can-ids-v3",
   "n_items": 4,
   "hardware": null,
   "date": "2026-10-10"
  },
  {
   "name": "fa_per_hour_default_unknown_vehicle_unknown_attack_median",
   "value": 0.2574935311954686,
   "unit": null,
   "description": "false alarms per hour of the alarm rule, unknown vehicle unknown attack, median over 4 sets",
   "reference": "can-train-and-test attack labels (official splits)",
   "benchmark": "can-ids-v3",
   "n_items": 4,
   "hardware": null,
   "date": "2026-10-10"
  },
  {
   "name": "fa_per_hour_default_unknown_vehicle_unknown_attack_worst",
   "value": 0.8610481024749033,
   "unit": null,
   "description": "false alarms per hour of the alarm rule, unknown vehicle unknown attack, worst over 4 sets",
   "reference": "can-train-and-test attack labels (official splits)",
   "benchmark": "can-ids-v3",
   "n_items": 4,
   "hardware": null,
   "date": "2026-10-10"
  },
  {
   "name": "f1_road",
   "value": 0.997176309778601,
   "unit": null,
   "description": "attack-class F1 per frame on ROAD (fabrication, fuzzing)",
   "reference": "ROAD injection labels",
   "benchmark": "can-ids-v3",
   "n_items": 5,
   "hardware": null,
   "date": "2026-10-10"
  },
  {
   "name": "fa_per_hour_road_ambient",
   "value": 0.0,
   "unit": null,
   "description": "false alarms per hour on the ROAD test ambient captures",
   "reference": "ROAD ambient captures (no attacks)",
   "benchmark": "can-ids-v3",
   "n_items": 4,
   "hardware": null,
   "date": "2026-10-10"
  },
  {
   "name": "fa_per_hour_kcid_ford_focus",
   "value": 0.0,
   "unit": null,
   "description": "false alarms per hour on 4.9 h of benign Ford Focus traffic (other drivers and days), calibration 15 min; vehicle in no training data",
   "reference": "KCID benign traces (no attacks)",
   "benchmark": "kcid",
   "n_items": 6,
   "hardware": null,
   "date": "2026-10-10"
  },
  {
   "name": "fa_per_hour_kcid_honda_cr_v",
   "value": 0.0,
   "unit": null,
   "description": "false alarms per hour on 48.0 h of benign Honda CR-V traffic (other drivers and days), calibration 15 min; vehicle in no training data",
   "reference": "KCID benign traces (no attacks)",
   "benchmark": "kcid",
   "n_items": 2,
   "hardware": null,
   "date": "2026-10-10"
  },
  {
   "name": "fa_per_hour_kcid_traverse_obd",
   "value": 0.0,
   "unit": null,
   "description": "false alarms per hour on 22.0 h of Traverse traffic with OBD requests, calibration 60 min including the diagnostic IDs",
   "reference": "KCID benign traces (no attacks)",
   "benchmark": "kcid",
   "n_items": 23,
   "hardware": null,
   "date": "2026-10-10"
  }
 ]
}
