{
 "kind": "performance",
 "model": "picket-forest",
 "version": "0.2.1",
 "synthetic": false,
 "source_run": "security can-ids measure",
 "metrics": [
  {
   "name": "latency_us_host",
   "value": 0.954,
   "unit": "us",
   "description": "whole chain per frame, host build incl. file I/O",
   "reference": null,
   "benchmark": null,
   "n_items": 200000,
   "hardware": "host arm64 (Darwin)",
   "origin": "host",
   "date": "2026-10-11"
  },
  {
   "name": "latency_us_esp32_qemu",
   "value": 25.0,
   "unit": "us",
   "description": "whole chain per frame, median (emulator: not representative)",
   "reference": null,
   "benchmark": null,
   "n_items": 4000,
   "hardware": "ESP32 in Espressif QEMU, 240 MHz nominal",
   "origin": "emulator",
   "date": "2026-10-11"
  },
  {
   "name": "latency_p99_us_esp32_qemu",
   "value": 58.0,
   "unit": "us",
   "description": "whole chain per frame, 99th percentile (emulator: not representative)",
   "reference": null,
   "benchmark": null,
   "n_items": 4000,
   "hardware": "ESP32 in Espressif QEMU, 240 MHz nominal",
   "origin": "emulator",
   "date": "2026-10-11"
  },
  {
   "name": "flash_kb_esp32_qemu",
   "value": 16.505,
   "unit": "KiB",
   "description": "detector code and constants (features, forest, alarm stage), from the object files",
   "reference": null,
   "benchmark": null,
   "n_items": null,
   "hardware": "ESP32 in Espressif QEMU, 240 MHz nominal",
   "origin": "emulator",
   "date": "2026-10-11"
  },
  {
   "name": "ram_kb_esp32_qemu",
   "value": 11.938,
   "unit": "KiB",
   "description": "detector static data plus the detector state",
   "reference": null,
   "benchmark": null,
   "n_items": null,
   "hardware": "ESP32 in Espressif QEMU, 240 MHz nominal",
   "origin": "emulator",
   "date": "2026-10-11"
  },
  {
   "name": "latency_us",
   "value": 25.0,
   "unit": "us",
   "description": "whole chain per frame, median (emulator: not representative)",
   "reference": null,
   "benchmark": null,
   "n_items": 4000,
   "hardware": "ESP32 in Espressif QEMU, 240 MHz nominal",
   "origin": "emulator",
   "date": "2026-10-11"
  },
  {
   "name": "latency_p99_us",
   "value": 58.0,
   "unit": "us",
   "description": "whole chain per frame, 99th percentile (emulator: not representative)",
   "reference": null,
   "benchmark": null,
   "n_items": 4000,
   "hardware": "ESP32 in Espressif QEMU, 240 MHz nominal",
   "origin": "emulator",
   "date": "2026-10-11"
  },
  {
   "name": "flash_kb",
   "value": 16.505,
   "unit": "KiB",
   "description": "detector code and constants (features, forest, alarm stage), from the object files",
   "reference": null,
   "benchmark": null,
   "n_items": null,
   "hardware": "ESP32 in Espressif QEMU, 240 MHz nominal",
   "origin": "emulator",
   "date": "2026-10-11"
  },
  {
   "name": "ram_kb",
   "value": 11.938,
   "unit": "KiB",
   "description": "detector static data plus the detector state",
   "reference": null,
   "benchmark": null,
   "n_items": null,
   "hardware": "ESP32 in Espressif QEMU, 240 MHz nominal",
   "origin": "emulator",
   "date": "2026-10-11"
  }
 ]
}
