{
 "kind": "performance",
 "model": "picket-forest",
 "version": "0.2.0",
 "synthetic": false,
 "source_run": "security can-ids measure",
 "metrics": [
  {
   "name": "latency_us_esp32",
   "value": 80.3,
   "unit": "us",
   "description": "whole chain per frame, median",
   "reference": null,
   "benchmark": null,
   "n_items": 4000,
   "hardware": "ESP32-D0WDQ6-V3 (board esp32-1, LilyGO LoRa32 / T-Beam style with AXP power chip, CH9102), 240 MHz, single-precision FPU",
   "origin": "real_board",
   "date": "2026-10-11"
  },
  {
   "name": "latency_p99_us_esp32",
   "value": 98.45,
   "unit": "us",
   "description": "whole chain per frame, 99th percentile",
   "reference": null,
   "benchmark": null,
   "n_items": 4000,
   "hardware": "ESP32-D0WDQ6-V3 (board esp32-1, LilyGO LoRa32 / T-Beam style with AXP power chip, CH9102), 240 MHz, single-precision FPU",
   "origin": "real_board",
   "date": "2026-10-11"
  },
  {
   "name": "flash_kb_esp32",
   "value": 16.505,
   "unit": "KiB",
   "description": "detector code and constants (features, forest, alarm stage), from the object files",
   "reference": null,
   "benchmark": null,
   "n_items": null,
   "hardware": "ESP32-D0WDQ6-V3 (board esp32-1, LilyGO LoRa32 / T-Beam style with AXP power chip, CH9102), 240 MHz, single-precision FPU",
   "origin": "real_board",
   "date": "2026-10-11"
  },
  {
   "name": "ram_kb_esp32",
   "value": 11.938,
   "unit": "KiB",
   "description": "detector static data plus the detector state",
   "reference": null,
   "benchmark": null,
   "n_items": null,
   "hardware": "ESP32-D0WDQ6-V3 (board esp32-1, LilyGO LoRa32 / T-Beam style with AXP power chip, CH9102), 240 MHz, single-precision FPU",
   "origin": "real_board",
   "date": "2026-10-11"
  }
 ]
}
